{
  "$schema": "https://json-schema.org/draft/2020-12/schema",
  "$id": "https://raw.githubusercontent.com/SII-Holos/synergy-plugins/main/schemas/plugin-entry.schema.json",
  "title": "Synergy Plugin Registry Entry v2",
  "type": "object",
  "additionalProperties": false,
  "required": [
    "schemaVersion",
    "id",
    "name",
    "description",
    "repo",
    "author",
    "verified",
    "official",
    "keywords",
    "compatibility",
    "versions",
    "yankedVersions"
  ],
  "properties": {
    "schemaVersion": { "const": 2 },
    "id": { "$ref": "#/$defs/pluginId" },
    "name": { "$ref": "#/$defs/pluginId" },
    "description": { "type": "string", "minLength": 1 },
    "repo": { "type": "string", "format": "uri" },
    "homepage": { "type": "string", "format": "uri" },
    "author": { "$ref": "#/$defs/author" },
    "icon": { "$ref": "#/$defs/icon" },
    "verified": { "type": "boolean" },
    "official": { "type": "boolean" },
    "keywords": {
      "type": "array",
      "items": { "type": "string", "minLength": 1 },
      "uniqueItems": true
    },
    "compatibility": { "$ref": "#/$defs/compatibility" },
    "versions": {
      "type": "array",
      "minItems": 1,
      "items": { "$ref": "#/$defs/version" }
    },
    "yankedVersions": {
      "type": "array",
      "items": { "type": "string", "minLength": 1 },
      "uniqueItems": true
    }
  },
  "$defs": {
    "pluginId": {
      "type": "string",
      "pattern": "^[a-z0-9][a-z0-9._-]*$"
    },
    "author": {
      "type": "object",
      "additionalProperties": false,
      "required": ["name"],
      "properties": {
        "name": { "type": "string", "minLength": 1 },
        "email": { "type": "string", "format": "email" },
        "url": { "type": "string", "format": "uri" }
      }
    },
    "compatibility": {
      "type": "object",
      "additionalProperties": false,
      "required": ["synergy"],
      "properties": {
        "synergy": { "type": "string", "minLength": 1 }
      }
    },
    "icon": {
      "oneOf": [
        {
          "type": "object",
          "additionalProperties": false,
          "required": ["type", "name"],
          "properties": {
            "type": { "const": "lucide" },
            "name": { "type": "string", "pattern": "^[a-z0-9][a-z0-9-]*$" }
          }
        },
        {
          "type": "object",
          "additionalProperties": false,
          "required": ["type", "path"],
          "properties": {
            "type": { "const": "registry-svg" },
            "path": { "type": "string", "pattern": "^icons/[a-z0-9][a-z0-9._-]*\\.svg$" }
          }
        }
      ]
    },
    "permission": {
      "type": "object",
      "additionalProperties": false,
      "required": ["key", "title", "description"],
      "properties": {
        "key": { "type": "string", "minLength": 1 },
        "title": { "type": "string", "minLength": 1 },
        "description": { "type": "string", "minLength": 1 },
        "category": { "type": "string", "minLength": 1 },
        "granted": { "type": "boolean" }
      }
    },
    "feature": {
      "type": "object",
      "additionalProperties": false,
      "required": ["key", "title", "description"],
      "properties": {
        "key": { "type": "string", "minLength": 1 },
        "title": { "type": "string", "minLength": 1 },
        "description": { "type": "string", "minLength": 1 }
      }
    },
    "version": {
      "type": "object",
      "additionalProperties": false,
      "required": [
        "version",
        "apiVersion",
        "compatibility",
        "downloadUrl",
        "signatureUrl",
        "signature",
        "integrity",
        "manifestHash",
        "permissionsHash",
        "runtimeMode",
        "permissionsSummary",
        "tools",
        "uiSurfaces",
        "publishedAt"
      ],
      "properties": {
        "version": { "type": "string", "minLength": 1 },
        "apiVersion": { "type": "string", "pattern": "^[0-9]+\\.[0-9]+$" },
        "compatibility": { "$ref": "#/$defs/compatibility" },
        "downloadUrl": { "type": "string", "format": "uri" },
        "signatureUrl": { "type": "string", "format": "uri" },
        "signature": { "$ref": "#/$defs/signature" },
        "integrity": { "type": "string", "pattern": "^sha256-[a-f0-9]{64}$" },
        "manifestHash": { "type": "string", "minLength": 1 },
        "permissionsHash": { "type": "string", "minLength": 1 },
        "runtimeMode": { "enum": ["in-process", "worker", "process"] },
        "featuresSummary": {
          "type": "array",
          "items": { "$ref": "#/$defs/feature" }
        },
        "permissionsSummary": {
          "type": "array",
          "items": { "$ref": "#/$defs/permission" }
        },
        "tools": {
          "type": "array",
          "items": { "type": "string", "minLength": 1 },
          "uniqueItems": true
        },
        "uiSurfaces": {
          "type": "array",
          "items": { "type": "string", "minLength": 1 },
          "uniqueItems": true
        },
        "publishedAt": { "type": "string", "format": "date-time" },
        "changelog": { "type": "string" }
      }
    },
    "signature": {
      "type": "object",
      "additionalProperties": false,
      "required": ["algorithm", "signer"],
      "properties": {
        "algorithm": { "const": "ed25519" },
        "signer": { "type": "string", "pattern": "^[a-f0-9]{64}$" }
      }
    }
  }
}
