{
  "schemaVersion": 2,
  "id": "hello-world",
  "name": "hello-world",
  "description": "Example Synergy plugin",
  "repo": "https://github.com/SII-Holos/hello-world-plugin",
  "homepage": "https://github.com/SII-Holos/hello-world-plugin",
  "author": {
    "name": "SII Holos"
  },
  "verified": true,
  "official": true,
  "keywords": ["synergy-plugin"],
  "compatibility": {
    "synergy": ">=3.0.11"
  },
  "versions": [
    {
      "version": "0.1.0",
      "apiVersion": "4.0",
      "compatibility": {
        "synergy": ">=3.0.11"
      },
      "downloadUrl": "https://github.com/SII-Holos/hello-world-plugin/releases/download/v0.1.0/hello-world-0.1.0.synergy-plugin.tgz",
      "signatureUrl": "https://github.com/SII-Holos/hello-world-plugin/releases/download/v0.1.0/hello-world-0.1.0.synergy-plugin.tgz.sig",
      "signature": {
        "algorithm": "ed25519",
        "signer": "0000000000000000000000000000000000000000000000000000000000000000"
      },
      "integrity": "sha256-...",
      "manifestHash": "...",
      "permissionsHash": "...",
      "runtimeMode": "process",
      "featuresSummary": [
        {
          "key": "tool:greet",
          "title": "Friendly greeting",
          "description": "Adds a greeting tool that agents can use when requested."
        }
      ],
      "permissionsSummary": [
        {
          "key": "workspace.read",
          "category": "files",
          "title": "Read workspace files",
          "description": "Can read files in the active workspace."
        }
      ],
      "tools": ["greet"],
      "uiSurfaces": ["toolRenderers"],
      "publishedAt": "2026-06-25T00:00:00.000Z",
      "changelog": "Initial release"
    }
  ],
  "yankedVersions": []
}
