{
  "schemaVersion": 2,
  "id": "synergy-remote-tailscale",
  "name": "synergy-remote-tailscale",
  "description": "Secure remote access to Synergy via Tailscale",
  "repo": "https://github.com/EricSanchezok/synergy-remote",
  "homepage": "https://github.com/EricSanchezok/synergy-remote",
  "author": {
    "name": "EricSanchez"
  },
  "verified": false,
  "official": false,
  "keywords": [
    "remote-access",
    "synergy-plugin",
    "tailscale"
  ],
  "compatibility": {
    "synergy": ">=1.1.27"
  },
  "versions": [
    {
      "version": "0.1.0",
      "apiVersion": "4.0",
      "compatibility": {
        "synergy": ">=1.1.27"
      },
      "downloadUrl": "https://github.com/EricSanchezok/synergy-remote/releases/download/v0.1.0/synergy-remote-tailscale-0.1.0.synergy-plugin.tgz",
      "signatureUrl": "https://github.com/EricSanchezok/synergy-remote/releases/download/v0.1.0/synergy-remote-tailscale-0.1.0.synergy-plugin.tgz.sig",
      "signature": {
        "algorithm": "ed25519",
        "signer": "77f644ff48e4f314431d3025689b53210d50e5feb53437bb265594ea5850a084"
      },
      "integrity": "sha256-2dc606adbeff6abda277b52be1bf459871a638b388c1ff0a250369951b6875c9",
      "manifestHash": "a0740678c4c3d64edc5e997598a0cbf409a7461cf53912e2aacb9ec29551f021",
      "permissionsHash": "d9dcddc7ea44e60f2a256083998af97fe3b84c803370be8516d049e21c266cfe",
      "runtimeMode": "process",
      "featuresSummary": [
        {
          "key": "ui",
          "title": "Synergy interface extensions",
          "description": "Adds 1 interface extension."
        }
      ],
      "permissionsSummary": [
        {
          "key": "runtime.endpoint.read",
          "title": "Runtime endpoint read",
          "description": "Can use the declared Synergy access runtime.endpoint.read."
        },
        {
          "key": "settings.read",
          "title": "Settings read",
          "description": "Can use the declared Synergy access settings.read."
        },
        {
          "key": "settings.write",
          "title": "Settings write",
          "description": "Can use the declared Synergy access settings.write."
        },
        {
          "key": "ui.hostActions",
          "title": "Ui hostActions",
          "description": "Can use the declared Synergy access ui.hostActions."
        }
      ],
      "tools": [],
      "uiSurfaces": [
        "ui.settings"
      ],
      "publishedAt": "2026-08-08T08:52:49.484Z"
    }
  ],
  "yankedVersions": []
}
