{
  "schemaVersion": 2,
  "id": "synergy-taskboard",
  "name": "synergy-taskboard",
  "description": "Kanban task board for humans and agents, inspired by dashi-taskboard (Linear-style workflow)",
  "repo": "https://github.com/yzxoi/synergy-taskboard",
  "author": {
    "name": "synergy-agent"
  },
  "verified": false,
  "official": false,
  "keywords": [
    "kanban",
    "linear",
    "project-management",
    "synergy-plugin",
    "taskboard",
    "tasks"
  ],
  "compatibility": {
    "synergy": ">=3.0.11"
  },
  "versions": [
    {
      "version": "1.1.0",
      "apiVersion": "4.0",
      "compatibility": {
        "synergy": ">=3.0.11"
      },
      "downloadUrl": "https://github.com/yzxoi/synergy-taskboard/releases/download/v1.1.0/synergy-taskboard-1.1.0.synergy-plugin.tgz",
      "signatureUrl": "https://github.com/yzxoi/synergy-taskboard/releases/download/v1.1.0/synergy-taskboard-1.1.0.synergy-plugin.tgz.sig",
      "signature": {
        "algorithm": "ed25519",
        "signer": "483a6c48d867e72b6d48158918da77237e15b3d0e6d9f4f6ae8393cd198280ee"
      },
      "integrity": "sha256-f52693ad4364f88ad9c8ac661c220bc750bc81d974e0d62e225268b460a33ae5",
      "manifestHash": "b5137068a0ec6e80d602c8d5dbc811986c5a4553a3ba0bff669490f4d089e0bb",
      "permissionsHash": "ccd7150fec45404747fc3aa6d66f7f3bd787d194bacda768ccdf491a3cdb4014",
      "runtimeMode": "process",
      "featuresSummary": [
        {
          "key": "tool:task-list",
          "title": "task-list",
          "description": "List tasks on the taskboard. Returns tasks with identifier, title, status, priority, labels, assignee, linked session count and version. Use this BEFORE creating or updating to avoid duplicates."
        },
        {
          "key": "tool:task-get",
          "title": "task-get",
          "description": "Get one task by its identifier (e.g. LOCAL-3) or id, including description, comments, linked session ids and focus session."
        },
        {
          "key": "tool:task-create",
          "title": "task-create",
          "description": "Create a task on the taskboard. The project defaults to 'local'. Returns the created task with its identifier and version."
        },
        {
          "key": "tool:task-update",
          "title": "task-update",
          "description": "Update a task. Requires the current `version` from task-list/task-get (optimistic concurrency). On VERSION_CONFLICT, re-read the task and retry."
        },
        {
          "key": "tool:task-move",
          "title": "task-move",
          "description": "Move a task to another status column. Typical workflow: todo -> in_progress (claim), in_progress -> in_review (done implementing, waiting for user acceptance), in_review -> done ONLY after the user explicitly confirms. Use blocked when stuck, canceled when abandoned."
        },
        {
          "key": "tool:task-comment",
          "title": "task-comment",
          "description": "Add a comment to a task. Summarize what you changed, how you verified it, and remaining risks."
        },
        {
          "key": "tool:task-link",
          "title": "task-link",
          "description": "Link the current session to a task so the agent sees it in context. If the task has no focus session yet, this session becomes the focus. Idempotent."
        },
        {
          "key": "tool:task-unlink",
          "title": "task-unlink",
          "description": "Unlink the current session from a task. The task stays on the board."
        },
        {
          "key": "tool:task-focus",
          "title": "task-focus",
          "description": "Make the current session the focus session of a task (must already be linked). The focus task is what gets injected into the system prompt."
        },
        {
          "key": "skills",
          "title": "Packaged skills",
          "description": "Provides 1 skill that agents can use when relevant."
        },
        {
          "key": "chat.system.transform",
          "title": "Conversation guidance",
          "description": "Adds plugin guidance to conversations when the feature is active."
        },
        {
          "key": "cli:project-create",
          "title": "project-create command",
          "description": "Create a taskboard project"
        },
        {
          "key": "cli:project-list",
          "title": "project-list command",
          "description": "List taskboard projects"
        },
        {
          "key": "cli:issue-create",
          "title": "issue-create command",
          "description": "Create a task on the taskboard"
        },
        {
          "key": "cli:issue-list",
          "title": "issue-list command",
          "description": "List tasks on the taskboard"
        },
        {
          "key": "cli:issue-get",
          "title": "issue-get command",
          "description": "Get one task by identifier or id, with comments"
        },
        {
          "key": "cli:issue-update",
          "title": "issue-update command",
          "description": "Update a task (requires --if-version for optimistic concurrency)"
        },
        {
          "key": "cli:issue-move",
          "title": "issue-move command",
          "description": "Move a task to another status (optimistic concurrency via --if-version)"
        },
        {
          "key": "cli:comment-add",
          "title": "comment-add command",
          "description": "Add a comment to a task"
        },
        {
          "key": "ui",
          "title": "Synergy interface extensions",
          "description": "Adds 3 interface extensions."
        }
      ],
      "permissionsSummary": [
        {
          "key": "workspace.read",
          "title": "Workspace read",
          "description": "Can use the declared Synergy access workspace.read."
        },
        {
          "key": "workspace.write",
          "title": "Workspace write",
          "description": "Can use the declared Synergy access workspace.write."
        },
        {
          "key": "settings.read",
          "title": "Settings read",
          "description": "Can use the declared Synergy access settings.read."
        },
        {
          "key": "settings.write",
          "title": "Settings write",
          "description": "Can use the declared Synergy access settings.write."
        },
        {
          "key": "session.read",
          "title": "Session read",
          "description": "Can use the declared Synergy access session.read."
        },
        {
          "key": "ui.hostActions",
          "title": "Ui hostActions",
          "description": "Can use the declared Synergy access ui.hostActions."
        }
      ],
      "tools": [
        "task-list",
        "task-get",
        "task-create",
        "task-update",
        "task-move",
        "task-comment",
        "task-link",
        "task-unlink",
        "task-focus"
      ],
      "uiSurfaces": [
        "ui.composerExtension",
        "ui.icon",
        "ui.navigationItem",
        "ui.settings"
      ],
      "publishedAt": "2026-08-07T08:12:12.001Z",
      "changelog": "Session-aware taskboard: tasks link to sessions, agent system-prompt injection, loose-trigger auto-create/link/advance, streamlined UI with centered detail modal, composer chip navigation fix, new task-link/unlink/focus tools, session.read + ui.hostActions capabilities"
    }
  ],
  "yankedVersions": [],
  "icon": {
    "type": "registry-svg",
    "path": "icons/synergy-taskboard.svg"
  }
}
